{
 "schema_version": "0.1.0",
 "capture": {
  "id": "single_scan_floor_only",
  "source": "stray_scanner",
  "device": "unknown",
  "input_sha256": "ec0e44cbce9e2ba8"
 },
 "tier": "lidar",
 "units": "m",
 "coordinate_frame": "gravity-aligned, z up, metres; x and y on the property's dominant (Manhattan) axes",
 "rooms": [
  {
   "id": "01_space",
   "label": "space",
   "label_confidence": 0.9,
   "polygon": [
    [
     -5.0662,
     -1.8795
    ],
    [
     -5.0662,
     1.1116
    ],
    [
     -6.6995,
     1.1116
    ],
    [
     -6.6995,
     -1.8795
    ]
   ],
   "walls": [
    {
     "id": "01_space:A",
     "start": [
      -5.0662,
      -1.8795
     ],
     "end": [
      -5.0662,
      1.1116
     ],
     "length": {
      "value": 1.6333,
      "ci_low": 1.624,
      "ci_high": 1.6426,
      "sigma": 0.0057,
      "source": "measured",
      "method": "rectilinear contour with edges snapped to the measured wall planes",
      "n_support": 27120
     },
     "surface_id": "01_space:wall:A"
    },
    {
     "id": "01_space:B",
     "start": [
      -5.0662,
      1.1116
     ],
     "end": [
      -6.6995,
      1.1116
     ],
     "length": {
      "value": 2.9911,
      "ci_low": 2.9818,
      "ci_high": 3.0004,
      "sigma": 0.0057,
      "source": "measured",
      "method": "rectilinear contour with edges snapped to the measured wall planes",
      "n_support": 2457
     },
     "surface_id": "01_space:wall:B"
    },
    {
     "id": "01_space:C",
     "start": [
      -6.6995,
      1.1116
     ],
     "end": [
      -6.6995,
      -1.8795
     ],
     "length": {
      "value": 1.6333,
      "ci_low": 1.624,
      "ci_high": 1.6426,
      "sigma": 0.0057,
      "source": "measured",
      "method": "rectilinear contour with edges snapped to the measured wall planes",
      "n_support": 2683
     },
     "surface_id": "01_space:wall:C"
    },
    {
     "id": "01_space:D",
     "start": [
      -6.6995,
      -1.8795
     ],
     "end": [
      -5.0662,
      -1.8795
     ],
     "length": {
      "value": 2.9911,
      "ci_low": 2.9818,
      "ci_high": 3.0004,
      "sigma": 0.0057,
      "source": "measured",
      "method": "rectilinear contour with edges snapped to the measured wall planes",
      "n_support": 81849
     },
     "surface_id": "01_space:wall:D"
    }
   ],
   "ceiling_height": {
    "value": 2.7,
    "ci_low": 2.2065,
    "ci_high": 3.1935,
    "sigma": 0.3,
    "source": "prior",
    "method": "no ceiling returns anywhere in the capture; regional prior",
    "n_support": 0
   },
   "ceiling_height_spread_m": 0.0,
   "floor_area": {
    "value": 4.8854,
    "ci_low": 4.8423,
    "ci_high": 4.9284,
    "sigma": 0.0262,
    "source": "measured",
    "method": "shoelace area of the dimensioned polygon",
    "n_support": 4
   },
   "openings": [
    {
     "id": "01_space:B:window:0",
     "wall_id": "01_space:B",
     "type": "window",
     "offset_along_wall": {
      "value": 0.0691,
      "ci_low": 0.0526,
      "ci_high": 0.0855,
      "sigma": 0.01,
      "source": "measured",
      "method": "half-maximum edge of the wall-material profile",
      "n_support": 56
     },
     "width": {
      "value": 0.7459,
      "ci_low": 0.7262,
      "ci_high": 0.7656,
      "sigma": 0.012,
      "source": "measured",
      "method": "half-maximum edges of the gap in the wall-material profile",
      "n_support": 56
     },
     "detection_confidence": 0.551,
     "height": {
      "value": 0.0482,
      "ci_low": -0.0011,
      "ci_high": 0.0976,
      "sigma": 0.03,
      "source": "measured",
      "method": "vertical extent of the gap",
      "n_support": 56
     },
     "sill_height": {
      "value": 0.0949,
      "ci_low": 0.0455,
      "ci_high": 0.1442,
      "sigma": 0.03,
      "source": "measured",
      "method": "top of the material below the gap",
      "n_support": 56
     }
    }
   ],
   "surfaces": [
    {
     "id": "01_space:wall:A",
     "room_id": "01_space",
     "kind": "wall",
     "area": {
      "value": 4.4099,
      "ci_low": 3.6035,
      "ci_high": 5.2163,
      "sigma": 0.4902,
      "source": "inferred",
      "method": "wall length x ceiling height",
      "n_support": 27120
     }
    },
    {
     "id": "01_space:wall:B",
     "room_id": "01_space",
     "kind": "wall",
     "area": {
      "value": 8.076,
      "ci_low": 6.5996,
      "ci_high": 9.5523,
      "sigma": 0.8975,
      "source": "inferred",
      "method": "wall length x ceiling height",
      "n_support": 2457
     }
    },
    {
     "id": "01_space:wall:C",
     "room_id": "01_space",
     "kind": "wall",
     "area": {
      "value": 4.4099,
      "ci_low": 3.6035,
      "ci_high": 5.2163,
      "sigma": 0.4902,
      "source": "inferred",
      "method": "wall length x ceiling height",
      "n_support": 2683
     }
    },
    {
     "id": "01_space:wall:D",
     "room_id": "01_space",
     "kind": "wall",
     "area": {
      "value": 8.076,
      "ci_low": 6.5996,
      "ci_high": 9.5523,
      "sigma": 0.8975,
      "source": "inferred",
      "method": "wall length x ceiling height",
      "n_support": 81849
     }
    },
    {
     "id": "01_space:floor",
     "room_id": "01_space",
     "kind": "floor",
     "area": {
      "value": 4.8854,
      "ci_low": 4.8423,
      "ci_high": 4.9284,
      "sigma": 0.0262,
      "source": "measured",
      "method": "shoelace area of the dimensioned polygon",
      "n_support": 4
     }
    },
    {
     "id": "01_space:ceiling",
     "room_id": "01_space",
     "kind": "ceiling",
     "area": {
      "value": 4.8854,
      "ci_low": 4.8423,
      "ci_high": 4.9284,
      "sigma": 0.0262,
      "source": "measured",
      "method": "shoelace area of the dimensioned polygon",
      "n_support": 4
     }
    }
   ],
   "quality": {
    "coverage_fraction": 1.0,
    "n_frames": 37,
    "exposure_score": 1.0,
    "mirror_suspected": false
   },
   "placement_confidence": 0.9,
   "warnings": [
    "the capture never looked at a ceiling: height is a prior, not a measurement"
   ]
  },
  {
   "id": "02_space",
   "label": "space",
   "label_confidence": 0.9,
   "polygon": [
    [
     -6.7371,
     -3.1645
    ],
    [
     -6.7371,
     -3.0395
    ],
    [
     -6.7014,
     -4.9941
    ],
    [
     -5.2337,
     -4.9941
    ],
    [
     -5.2337,
     -4.8895
    ],
    [
     -4.8968,
     -5.005
    ],
    [
     -4.7973,
     -5.005
    ],
    [
     -5.69,
     -5.3545
    ],
    [
     -5.69,
     -8.426
    ],
    [
     -4.1723,
     -8.426
    ],
    [
     -4.1723,
     -8.9146
    ],
    [
     -3.1136,
     -8.9146
    ],
    [
     -3.1136,
     -6.7395
    ],
    [
     -3.1168,
     -4.5319
    ],
    [
     0.2027,
     -4.5319
    ],
    [
     -3.8013,
     -4.533
    ],
    [
     -3.8013,
     -3.4895
    ],
    [
     -4.1406,
     -1.7895
    ],
    [
     -4.8965,
     -2.7743
    ],
    [
     -7.6973,
     -2.7743
    ]
   ],
   "walls": [
    {
     "id": "02_space:A",
     "start": [
      -6.7371,
      -3.1645
     ],
     "end": [
      -6.7371,
      -3.0395
     ],
     "length": {
      "value": 0.9601,
      "ci_low": 0.9508,
      "ci_high": 0.9694,
      "sigma": 0.0057,
      "source": "inferred",
      "method": "rectilinear contour with edges snapped to the measured wall planes",
      "n_support": 0
     },
     "surface_id": "02_space:wall:A"
    },
    {
     "id": "02_space:B",
     "start": [
      -6.7371,
      -3.0395
     ],
     "end": [
      -6.7014,
      -4.9941
     ],
     "length": {
      "value": 0.125,
      "ci_low": 0.0261,
      "ci_high": 0.2239,
      "sigma": 0.0601,
      "source": "measured",
      "method": "rectilinear contour with edges snapped to the measured wall planes",
      "n_support": 1072
     },
     "surface_id": "02_space:wall:B"
    },
    {
     "id": "02_space:C",
     "start": [
      -6.7014,
      -4.9941
     ],
     "end": [
      -5.2337,
      -4.9941
     ],
     "length": {
      "value": 1.9546,
      "ci_low": 1.9453,
      "ci_high": 1.9639,
      "sigma": 0.0057,
      "source": "measured",
      "method": "rectilinear contour with edges snapped to the measured wall planes",
      "n_support": 11197
     },
     "surface_id": "02_space:wall:C"
    },
    {
     "id": "02_space:D",
     "start": [
      -5.2337,
      -4.9941
     ],
     "end": [
      -5.2337,
      -4.8895
     ],
     "length": {
      "value": 1.4677,
      "ci_low": 1.3688,
      "ci_high": 1.5666,
      "sigma": 0.0601,
      "source": "measured",
      "method": "rectilinear contour with edges snapped to the measured wall planes",
      "n_support": 32249
     },
     "surface_id": "02_space:wall:D"
    },
    {
     "id": "02_space:E",
     "start": [
      -5.2337,
      -4.8895
     ],
     "end": [
      -4.8968,
      -5.005
     ],
     "length": {
      "value": 0.1046,
      "ci_low": 0.0057,
      "ci_high": 0.2036,
      "sigma": 0.0601,
      "source": "inferred",
      "method": "rectilinear contour with edges snapped to the measured wall planes",
      "n_support": 0
     },
     "surface_id": "02_space:wall:E"
    },
    {
     "id": "02_space:F",
     "start": [
      -4.8968,
      -5.005
     ],
     "end": [
      -4.7973,
      -5.005
     ],
     "length": {
      "value": 0.1155,
      "ci_low": 0.0166,
      "ci_high": 0.2144,
      "sigma": 0.0601,
      "source": "inferred",
      "method": "rectilinear contour with edges snapped to the measured wall planes",
      "n_support": 0
     },
     "surface_id": "02_space:wall:F"
    },
    {
     "id": "02_space:G",
     "start": [
      -4.7973,
      -5.005
     ],
     "end": [
      -5.69,
      -5.3545
     ],
     "length": {
      "value": 0.0996,
      "ci_low": -0.04,
      "ci_high": 0.2391,
      "sigma": 0.0849,
      "source": "measured",
      "method": "rectilinear contour with edges snapped to the measured wall planes",
      "n_support": 271
     },